{"name":"my-home","desc":"","tables":[{"name":"electricity_daily_usages","type":"BASE TABLE","comment":"日間電気使用状況","columns":[{"name":"usage_year","type":"int(10) unsigned","nullable":false,"default":null,"comment":"年"},{"name":"usage_month","type":"int(10) unsigned","nullable":false,"default":null,"comment":"月"},{"name":"usage_date","type":"int(10) unsigned","nullable":false,"default":null,"comment":"日"},{"name":"usage_amount","type":"decimal(15,5) unsigned","nullable":false,"default":null,"comment":"使用量(kWh)"},{"name":"created_at","type":"datetime","nullable":false,"default":"current_timestamp()","comment":"作成日時(UTC)"},{"name":"updated_at","type":"datetime","nullable":false,"default":"current_timestamp()","extra_def":"on update current_timestamp()","comment":"更新日時(UTC)"}],"indexes":[{"name":"PRIMARY","def":"PRIMARY KEY (usage_year, usage_month, usage_date) USING BTREE","table":"electricity_daily_usages","columns":["usage_year","usage_month","usage_date"],"comment":""}],"constraints":[{"name":"PRIMARY","type":"PRIMARY KEY","def":"PRIMARY KEY (usage_year, usage_month, usage_date)","table":"electricity_daily_usages","referenced_table":null,"columns":["usage_year","usage_month","usage_date"],"referenced_columns":null,"comment":""}],"triggers":[],"def":"CREATE TABLE `electricity_daily_usages` (\n  `usage_year` int(10) unsigned NOT NULL COMMENT '年',\n  `usage_month` int(10) unsigned NOT NULL COMMENT '月',\n  `usage_date` int(10) unsigned NOT NULL COMMENT '日',\n  `usage_amount` decimal(15,5) unsigned NOT NULL COMMENT '使用量(kWh)',\n  `created_at` datetime NOT NULL DEFAULT current_timestamp() COMMENT '作成日時(UTC)',\n  `updated_at` datetime NOT NULL DEFAULT current_timestamp() ON UPDATE current_timestamp() COMMENT '更新日時(UTC)',\n  PRIMARY KEY (`usage_year`,`usage_month`,`usage_date`)\n) ENGINE=InnoDB DEFAULT CHARSET=utf8mb4 COLLATE=utf8mb4_general_ci COMMENT='日間電気使用状況'"},{"name":"electricity_monthly_usages","type":"BASE TABLE","comment":"月間電気使用状況","columns":[{"name":"usage_year","type":"int(10) unsigned","nullable":false,"default":null,"comment":"年"},{"name":"usage_month","type":"int(10) unsigned","nullable":false,"default":null,"comment":"月"},{"name":"usage_day_count","type":"int(10) unsigned","nullable":false,"default":null,"comment":"使用日数"},{"name":"usage_kwh","type":"int(10) unsigned","nullable":false,"default":null,"comment":"使用量(kWh)"},{"name":"usage_yen","type":"int(10) unsigned","nullable":false,"default":null,"comment":"料金(円)"},{"name":"created_at","type":"datetime","nullable":false,"default":"current_timestamp()","comment":"作成日時"},{"name":"updated_at","type":"datetime","nullable":false,"default":"current_timestamp()","extra_def":"on update current_timestamp()","comment":"更新日時"}],"indexes":[{"name":"PRIMARY","def":"PRIMARY KEY (usage_year, usage_month) USING BTREE","table":"electricity_monthly_usages","columns":["usage_year","usage_month"],"comment":""}],"constraints":[{"name":"PRIMARY","type":"PRIMARY KEY","def":"PRIMARY KEY (usage_year, usage_month)","table":"electricity_monthly_usages","referenced_table":null,"columns":["usage_year","usage_month"],"referenced_columns":null,"comment":""}],"triggers":[],"def":"CREATE TABLE `electricity_monthly_usages` (\n  `usage_year` int(10) unsigned NOT NULL COMMENT '年',\n  `usage_month` int(10) unsigned NOT NULL COMMENT '月',\n  `usage_day_count` int(10) unsigned NOT NULL COMMENT '使用日数',\n  `usage_kwh` int(10) unsigned NOT NULL COMMENT '使用量(kWh)',\n  `usage_yen` int(10) unsigned NOT NULL COMMENT '料金(円)',\n  `created_at` datetime NOT NULL DEFAULT current_timestamp() COMMENT '作成日時',\n  `updated_at` datetime NOT NULL DEFAULT current_timestamp() ON UPDATE current_timestamp() COMMENT '更新日時',\n  PRIMARY KEY (`usage_year`,`usage_month`)\n) ENGINE=InnoDB DEFAULT CHARSET=utf8mb4 COLLATE=utf8mb4_general_ci COMMENT='月間電気使用状況'"},{"name":"gas_monthly_usages","type":"BASE TABLE","comment":"月間ガス使用状況","columns":[{"name":"usage_year","type":"int(10) unsigned","nullable":false,"default":null,"comment":"年"},{"name":"usage_month","type":"int(10) unsigned","nullable":false,"default":null,"comment":"月"},{"name":"usage_begin_at","type":"date","nullable":false,"default":null,"comment":"開始日"},{"name":"usage_end_at","type":"date","nullable":false,"default":null,"comment":"終了日"},{"name":"usage_amount","type":"decimal(15,5) unsigned","nullable":false,"default":null,"comment":"使用量(m^3)"},{"name":"usage_yen","type":"int(10) unsigned","nullable":false,"default":null,"comment":"料金(円)"},{"name":"created_at","type":"datetime","nullable":false,"default":"current_timestamp()","comment":"作成日時"},{"name":"updated_at","type":"datetime","nullable":false,"default":"current_timestamp()","extra_def":"on update current_timestamp()","comment":"更新日時"}],"indexes":[{"name":"PRIMARY","def":"PRIMARY KEY (usage_year, usage_month) USING BTREE","table":"gas_monthly_usages","columns":["usage_year","usage_month"],"comment":""}],"constraints":[{"name":"PRIMARY","type":"PRIMARY KEY","def":"PRIMARY KEY (usage_year, usage_month)","table":"gas_monthly_usages","referenced_table":null,"columns":["usage_year","usage_month"],"referenced_columns":null,"comment":""}],"triggers":[],"def":"CREATE TABLE `gas_monthly_usages` (\n  `usage_year` int(10) unsigned NOT NULL COMMENT '年',\n  `usage_month` int(10) unsigned NOT NULL COMMENT '月',\n  `usage_begin_at` date NOT NULL COMMENT '開始日',\n  `usage_end_at` date NOT NULL COMMENT '終了日',\n  `usage_amount` decimal(15,5) unsigned NOT NULL COMMENT '使用量(m^3)',\n  `usage_yen` int(10) unsigned NOT NULL COMMENT '料金(円)',\n  `created_at` datetime NOT NULL DEFAULT current_timestamp() COMMENT '作成日時',\n  `updated_at` datetime NOT NULL DEFAULT current_timestamp() ON UPDATE current_timestamp() COMMENT '更新日時',\n  PRIMARY KEY (`usage_year`,`usage_month`)\n) ENGINE=InnoDB DEFAULT CHARSET=utf8mb4 COLLATE=utf8mb4_general_ci COMMENT='月間ガス使用状況'"},{"name":"water_monthly_usages","type":"BASE TABLE","comment":"月間水道使用状況","columns":[{"name":"usage_year","type":"int(10) unsigned","nullable":false,"default":null,"comment":"年"},{"name":"usage_month","type":"int(10) unsigned","nullable":false,"default":null,"comment":"月"},{"name":"usage_begin_at","type":"date","nullable":false,"default":null,"comment":"開始日"},{"name":"usage_end_at","type":"date","nullable":false,"default":null,"comment":"終了日"},{"name":"usage_amount","type":"decimal(15,5) unsigned","nullable":false,"default":null,"comment":"使用量(m^3)"},{"name":"usage_yen","type":"int(10) unsigned","nullable":false,"default":null,"comment":"料金(円)"},{"name":"created_at","type":"datetime","nullable":false,"default":"current_timestamp()","comment":"作成日時"},{"name":"updated_at","type":"datetime","nullable":false,"default":"current_timestamp()","extra_def":"on update current_timestamp()","comment":"更新日時"}],"indexes":[{"name":"PRIMARY","def":"PRIMARY KEY (usage_year, usage_month) USING BTREE","table":"water_monthly_usages","columns":["usage_year","usage_month"],"comment":""}],"constraints":[{"name":"PRIMARY","type":"PRIMARY KEY","def":"PRIMARY KEY (usage_year, usage_month)","table":"water_monthly_usages","referenced_table":null,"columns":["usage_year","usage_month"],"referenced_columns":null,"comment":""}],"triggers":[],"def":"CREATE TABLE `water_monthly_usages` (\n  `usage_year` int(10) unsigned NOT NULL COMMENT '年',\n  `usage_month` int(10) unsigned NOT NULL COMMENT '月',\n  `usage_begin_at` date NOT NULL COMMENT '開始日',\n  `usage_end_at` date NOT NULL COMMENT '終了日',\n  `usage_amount` decimal(15,5) unsigned NOT NULL COMMENT '使用量(m^3)',\n  `usage_yen` int(10) unsigned NOT NULL COMMENT '料金(円)',\n  `created_at` datetime NOT NULL DEFAULT current_timestamp() COMMENT '作成日時',\n  `updated_at` datetime NOT NULL DEFAULT current_timestamp() ON UPDATE current_timestamp() COMMENT '更新日時',\n  PRIMARY KEY (`usage_year`,`usage_month`)\n) ENGINE=InnoDB DEFAULT CHARSET=utf8mb4 COLLATE=utf8mb4_general_ci COMMENT='月間水道使用状況'"}],"relations":[],"functions":[],"driver":{"name":"mariadb","database_version":"10.11.4-MariaDB-1:10.11.4+maria~ubu2204","meta":{"dict":{"Functions":"Stored procedures and functions"}}}}
